{
  "版": 1,
  "要求種別": "全Runtime停止要求",
  "対象": [
    {
      "実行系ID": "development-lifecycle-fixture",
      "状態": "ready",
      "承認必要": true,
      "停止実行済み": false,
      "再承認状態": "owner_reapproval_required",
      "復旧ID": "recover-runtime-stop-request"
    }
  ],
  "承認状態": "owner_reapproval_required",
  "停止実行済み": false,
  "証拠種別": "INTERNAL_STATE",
  "権限生成": "なし",
  "復旧ID": "recover-runtime-stop-request"
}
